<?xml version="1.0" encoding="UTF-8"?>
<skill xmlns:xsi="http://www.w3.org/2001/XMLSchema-instance"
      xsi:noNamespaceSchemaLocation="../schemas/skill.xsd"
      id="014-agile-user-story"
      interactive="true">
  <metadata>
    <author>Juan Antonio Breña Moral</author>
    <version>0.13.0-SNAPSHOT</version>
    <license>Apache-2.0</license>
  </metadata>

  <title>Create Agile User Stories and Gherkin Feature Files</title>
  <description>Guides the creation of agile user stories and Gherkin feature files. Use when the user wants to create a user story, write acceptance criteria, define Gherkin scenarios, or author BDD feature files.</description>
  <goal><![CDATA[
Guide the agent to ask targeted questions to gather details for a user story and its Gherkin acceptance criteria, then generate a Markdown user story and a separate Gherkin `.feature` file. **This is an interactive SKILL**.

**What is covered in this Skill?**

- User story core details: title, persona, goal, benefit
- Gherkin feature file: Feature name, background steps, scenarios
- Acceptance criteria: Given / When / Then with data examples
- File naming and linking between user story and feature file
]]></goal>

  <constraints>
    <constraints-description>Before generating artifacts, gather all required information through structured questions. Use exact wording from the template and wait for user responses.</constraints-description>
    <constraint-list>
      <constraint>**MANDATORY**: Ask questions from the template one-by-one in strict order before generating any artifacts</constraint>
      <constraint>**MUST**: Read the reference template fresh and use exact wording—do not use cached questions</constraint>
      <constraint>**MUST**: Wait for user response after each question or block before proceeding</constraint>
      <constraint>**MUST**: Repeat scenario questions for each additional scenario when user indicates more scenarios</constraint>
    </constraint-list>
  </constraints>

  <reference path="references/014-agile-user-story.md" />
</skill>
