<?xml version="1.0" encoding="UTF-8"?>
<skill xmlns:xsi="http://www.w3.org/2001/XMLSchema-instance"
      xsi:noNamespaceSchemaLocation="../schemas/skill.xsd"
      id="172-java-diagrams"
      interactive="true">
  <metadata>
    <author>Juan Antonio Breña Moral</author>
    <version>0.13.0-SNAPSHOT</version>
    <license>Apache-2.0</license>
  </metadata>

  <title>Java Diagrams Generator with modular step-based configuration</title>
  <description>Use when you need to generate Java project diagrams — including UML sequence diagrams, UML class diagrams, C4 model diagrams, UML state machine diagrams, and ER (Entity Relationship) diagrams — through a modular, step-based interactive process that adapts to your specific visualization needs.</description>
  <goal><![CDATA[
Generate comprehensive Java project diagrams through a modular, step-based interactive process that covers UML sequence diagrams, UML class diagrams, C4 model diagrams, UML state machine diagrams, and ER (Entity Relationship) diagrams using PlantUML syntax. **This is an interactive SKILL**.

**What is covered in this Skill?**

- UML sequence diagram generation for application workflows and API interactions
- UML class diagram generation for package structure and class relationships
- C4 model diagram generation at Context/Container/Component levels only (levels 1–3; Code/Level 4 not generated)
- UML state machine diagram generation for entity lifecycles and business workflows
- ER diagram generation from SQL schema (DDL, migrations) using PlantUML Chen notation
- PlantUML syntax for all diagram types
- File organization strategies: single-file, separate-files, or integrated with existing documentation
- Final diagram validation with PlantUML syntax checking
]]></goal>

  <constraints>
    <constraints-description>Before applying any diagram generation, ensure the project validates. If validation fails, stop immediately — do not proceed until all validation errors are resolved.</constraints-description>
    <constraint-list>
      <constraint>**MANDATORY**: Run `./mvnw validate` or `mvn validate` before applying any diagram generation</constraint>
      <constraint>**SAFETY**: If validation fails, stop immediately — do not proceed until all validation errors are resolved</constraint>
      <constraint>**BEFORE APPLYING**: Read the reference for detailed good/bad examples, constraints, and safeguards for each diagram generation pattern</constraint>
      <constraint>**C4 LIMIT**: C4 diagrams restricted to levels 1, 2, 3 only (Context, Container, Component); never generate Level 4 (Code) diagrams</constraint>
    </constraint-list>
  </constraints>

  <reference path="references/172-java-diagrams.md" />
</skill>
